Day 8 10/11/26


UPDATE:
1. UPDATE SALARIES WITH 2000 FOR ACTIVE IT EMPLOYEES WHO EARN LESS THAN 6000
--- UPDATE EMPLOYEES SET SALARY=SALARY+2000 WHERE DEPARTMENT='IT' AND ISACTIVE=1;

2. MAKE FINANCE OR INACTIVE EMPLOYEES SALARY 10% LESS(DEMOTION SCENARIO)
-- UPDATE EMPLOYEES SET SALARY=SALARY-(SALARY*0.10) WHERE DEPARTMENT='FINANCE' OR ISACTIVE=0;

3. DEACTIVE ALL EMPLOYEES NOT IN THE IT DEPARTMENT
-- UPDATE EMPLOYEES SET ISACTIVE=FALSE WHERE NOT DEPARTMENT='IT';


DELETE:
1. Delete employees from the HR department who are also inactive
delete from employees where department='hr' and isactive=false;

2. Delete employees who are either from Finance or have a salary less than 35000
delete from employees where department='finance' or salary<35000;

3.Delete all employees not in the IT department
delete from employees where not department='it';


IS NULL AND NOT NULL
1.Get all projects that are not assigned to anyone
SELECT*FROM PROJECTS WHERE ASSIGNEDTO IS NULL;

2.Get projects that have not started yet:
SELECT*FROM PROJECTS WHERE START IS NULL;

3.Get all projects that have been completed
SELECT*FROM PROJECTS WHERE END IS NOT NULL;

4. Get all projects with an assigned team member
SELECT*FROM PROJECTS WHERE ASSIGNEDTO IS NOT NULL;


1.Assign unassigned projects to a default person (Eg; Frank)
UPDATE PROJECTS SET NAME='FRANK' WHERE ASSIGNEDTO IS NULL;

2.Update start date to today for projects that haven't started
UPDATE PROJECTS SET START=CURDATE() WHERE START IS NULL;

3.Update the project name of all completed projects to "completed" instead of the existing name.
UPDATE PROJECTS SET NAME='COMPLETED' WHERE END IS NOT NULL;


1.Delete unassigned projects
DELETE FROM PROJECTS WHERE ASSIGNEDTO IS NULL;

2. Delete projects that haven't started yet
DELETE FROM PROJECTS WHERE START IS NULL;

3.Delete projects that are already completed
DELETE FROM PROJECTS WHERE END IS NOT NULL;

1.SELECT ORDER DETAILS IN BETWEEN "2024-03-03" TO "2024-03-10"
SELECT*FROM ORDERS WHERE ORDER_DATE BETWEEN '2024-03-03' AND '2024-03-10';

2. DISPLAY ORDERS PLACED BETWEEN '2024-04-01' TO '2024-04-30'
SELECT*FROM ORDERS WHERE ORDER_DATE BETWEEN '2024-04-01' AND '2024-04-30';

3.DISPLAY ORDERS WHOSE TOTAL AMOUNT IS BETWEEN 500 AND 1500
SELECT*FROM ORDERS WHERE TOTAL_AMOUNT BETWEEN 500 AND 1500;

4.INCREASE PRICE OF THE PRODUCTS ORDERED IN BETWEEN "2024-3-4" TO "2024-3-10" WITH 1000.
 UPDATE ORDERS SET TOTAL_AMOUNT=TOTAL_AMOUNT+1000 WHERE ORDER_DATE BETWEEN '2024-03-04' AND '2024-03-10';

5. REDUCE THE TOTAL AMOUNT BY 200 FOR ORDERS BETWEEN 1000 AND 2000
 update orders set total_amount=total_amount-200 where total_amount between 1000 and 2000;

6. INCREASE THE TOTAL AMOUNT BY 10% FOR ORDERS BETWEEN 2500 AND 5000
update orders set total_amount=total_amount+(total_amount*0.10) where total_amount between 2500 and 5000;

7.REMOVE PRODUCTS FROM ORDERS PLACED IN BETWEEN "2024-3-10" AND "2024-3-20"
delete from orders where order_date between '2024-03-10' and '2024-03-20';

8. delete from orders where total_amount between 2500 and 5000;

IN OPERATOR

1. GET EMPLOYEES FROM IT AND FINANCE DEPARTMENTS
SELECT*FROM EMP WHERE DEPT IN('FINANCE','IT');

2. INCREASE SALARY BY 2000 FOR EMPLOYEES IN HR OR MARKETING
UPDATE EMP SET SALARY=(SALARY+2000) WHERE DEPT IN('HR','MARKETING');

3.REMOVE EMPLOYEES FROM THE FINANCE OR MARKETING
DELETE FROM EMP WHERE DEPT IN('FINANCE','MARKETING');


CASE OPERATOR
SYNTAX:
SELECT EMP_NAME,
    -> SALARY,
    -> CASE
    -> WHEN SALARY>=80000 THEN 'HIGH SALARY'
    -> WHEN SALARY>=60000 THEN 'MEDIUM-SALARY'
    -> ELSE 'LOW SALARY'
    -> END AS SALARY_CATEGORY
    -> FROM EMPLOYEES;

>=10 EXPERT
>=5 SENIOR
>=2 JUNIOR FRESHER
SYNTAX:
SELECT EMP_NAME,
    -> EXPERIENCE,
    -> CASE
    -> WHEN EXPERIENCE>=10 THEN 'EXPERT'
    -> WHEN EXPERIENCE>=5 THEN 'SENIOR'
    -> WHEN EXPERIENCE>=2 THEN 'JUNIOR FRESER'
    -> ELSE 'FRESHER'
    -> END AS EXPERIENCE_LEVEL
    -> FROM EMPLOYEES;

LIKE OPERATOR
SELECT*FROM EMPLOYEES WHERE EMP_NAME LIKE 'R%';
R% STARTING
&A ENDING
R%A GIVES STARTING LETTER R AND ENDING A
SELECT*FROM EMPLOYEES WHERE EMP_NAME LIKE '%A';
SELECT*FROM EMPLOYEES WHERE EMP_NAME LIKE 'P%A';
SELECT*FROM EMPLOYEES WHERE EMP_NAME LIKE '____';
SELECT*FROM EMPLOYEES WHERE EMP_NAME LIKE '%A%';
SELECT*FROM EMPLOYEES WHERE EMP_NAME LIKE 'A%I';
SELECT*FROM EMPLOYEES WHERE EMP_NAME LIKE 'A_I';

use da6;
Database changed
mysql> UPDATE EMPLOYEES SET SALARY=SALARY+2000 WHERE DEPARTMENT='IT' AND ISACTIVE=1;
Query OK, 4 rows affected (2.49 sec)
Rows matched: 4  Changed: 4  Warnings: 0

mysql> select*from employees;
+------+---------------+------------+--------+----------+
| id   | name          | department | salary | isactive |
+------+---------------+------------+--------+----------+
|    1 | Rahul Sharma  | IT         |  52000 |        1 |
|    2 | Priya Reddy   | HR         |  30000 |        1 |
|    3 | Amit Kumar    | Finance    |  45000 |        0 |
|    4 | Sneha Patel   | IT         |  37000 |        1 |
|    5 | Vikram Singh  | Finance    |  28000 |        1 |
|    6 | Anjali Mehta  | HR         |  32000 |        0 |
|    7 | Kiran Rao     | IT         |  62000 |        1 |
|    8 | Pooja Verma   | Marketing  |  27000 |        1 |
|    9 | Ramesh Naidu  | Sales      |  38000 |        1 |
|   10 | Deepika Joshi | Finance    |  52000 |        1 |
|   11 | Suresh Babu   | Marketing  |  29000 |        0 |
|   12 | Neha Kapoor   | HR         |  41000 |        1 |
|   13 | Arjun Reddy   | IT         |  55000 |        0 |
|   14 | Lakshmi Devi  | Sales      |  33000 |        1 |
|   15 | Nikhil Jain   | IT         |  49000 |        1 |
+------+---------------+------------+--------+----------+
15 rows in set (0.63 sec)

mysql> UPDATE EMPLOYEES SET SALARY=SALARY-(SALARY*0.10) WHERE DEPARTMENT='FINANCE' OR ISACTIVE=0;
Query OK, 6 rows affected (2.33 sec)
Rows matched: 6  Changed: 6  Warnings: 0

mysql> select*from employees;
+------+---------------+------------+--------+----------+
| id   | name          | department | salary | isactive |
+------+---------------+------------+--------+----------+
|    1 | Rahul Sharma  | IT         |  52000 |        1 |
|    2 | Priya Reddy   | HR         |  30000 |        1 |
|    3 | Amit Kumar    | Finance    |  40500 |        0 |
|    4 | Sneha Patel   | IT         |  37000 |        1 |
|    5 | Vikram Singh  | Finance    |  25200 |        1 |
|    6 | Anjali Mehta  | HR         |  28800 |        0 |
|    7 | Kiran Rao     | IT         |  62000 |        1 |
|    8 | Pooja Verma   | Marketing  |  27000 |        1 |
|    9 | Ramesh Naidu  | Sales      |  38000 |        1 |
|   10 | Deepika Joshi | Finance    |  46800 |        1 |
|   11 | Suresh Babu   | Marketing  |  26100 |        0 |
|   12 | Neha Kapoor   | HR         |  41000 |        1 |
|   13 | Arjun Reddy   | IT         |  49500 |        0 |
|   14 | Lakshmi Devi  | Sales      |  33000 |        1 |
|   15 | Nikhil Jain   | IT         |  49000 |        1 |
+------+---------------+------------+--------+----------+
15 rows in set (0.00 sec)

mysql> UPDATE EMPLOYEES SET ISACTIVE=FALSE WHERE NOT DEPARTMENT='IT';
Query OK, 7 rows affected (0.62 sec)
Rows matched: 10  Changed: 7  Warnings: 0

mysql> select*from employees;
+------+---------------+------------+--------+----------+
| id   | name          | department | salary | isactive |
+------+---------------+------------+--------+----------+
|    1 | Rahul Sharma  | IT         |  52000 |        1 |
|    2 | Priya Reddy   | HR         |  30000 |        0 |
|    3 | Amit Kumar    | Finance    |  40500 |        0 |
|    4 | Sneha Patel   | IT         |  37000 |        1 |
|    5 | Vikram Singh  | Finance    |  25200 |        0 |
|    6 | Anjali Mehta  | HR         |  28800 |        0 |
|    7 | Kiran Rao     | IT         |  62000 |        1 |
|    8 | Pooja Verma   | Marketing  |  27000 |        0 |
|    9 | Ramesh Naidu  | Sales      |  38000 |        0 |
|   10 | Deepika Joshi | Finance    |  46800 |        0 |
|   11 | Suresh Babu   | Marketing  |  26100 |        0 |
|   12 | Neha Kapoor   | HR         |  41000 |        0 |
|   13 | Arjun Reddy   | IT         |  49500 |        0 |
|   14 | Lakshmi Devi  | Sales      |  33000 |        0 |
|   15 | Nikhil Jain   | IT         |  49000 |        1 |
+------+---------------+------------+--------+----------+
15 rows in set (0.00 sec)

mysql> delete from employees where department='hr' and is active='false';
ERROR 1064 (42000): You have an error in your SQL syntax; check the manual that corresponds to your MySQL server version for the right syntax to use near 'is active='false'' at line 1
mysql> delete from employees where department='hr' and isactive='false';
ERROR 1292 (22007): Truncated incorrect DOUBLE value: 'false'
mysql> delete from employees where department='hr' and isactive=false;
Query OK, 3 rows affected (0.01 sec)

mysql> SELECT*FROM EMPLOYEES;
+------+---------------+------------+--------+----------+
| id   | name          | department | salary | isactive |
+------+---------------+------------+--------+----------+
|    1 | Rahul Sharma  | IT         |  52000 |        1 |
|    3 | Amit Kumar    | Finance    |  40500 |        0 |
|    4 | Sneha Patel   | IT         |  37000 |        1 |
|    5 | Vikram Singh  | Finance    |  25200 |        0 |
|    7 | Kiran Rao     | IT         |  62000 |        1 |
|    8 | Pooja Verma   | Marketing  |  27000 |        0 |
|    9 | Ramesh Naidu  | Sales      |  38000 |        0 |
|   10 | Deepika Joshi | Finance    |  46800 |        0 |
|   11 | Suresh Babu   | Marketing  |  26100 |        0 |
|   13 | Arjun Reddy   | IT         |  49500 |        0 |
|   14 | Lakshmi Devi  | Sales      |  33000 |        0 |
|   15 | Nikhil Jain   | IT         |  49000 |        1 |
+------+---------------+------------+--------+----------+
12 rows in set (0.00 sec)

mysql> delete from employees where department='finance' or salary<35000;
Query OK, 6 rows affected (0.27 sec)

mysql> SELECT*FROM EMPLOYEES;
+------+--------------+------------+--------+----------+
| id   | name         | department | salary | isactive |
+------+--------------+------------+--------+----------+
|    1 | Rahul Sharma | IT         |  52000 |        1 |
|    4 | Sneha Patel  | IT         |  37000 |        1 |
|    7 | Kiran Rao    | IT         |  62000 |        1 |
|    9 | Ramesh Naidu | Sales      |  38000 |        0 |
|   13 | Arjun Reddy  | IT         |  49500 |        0 |
|   15 | Nikhil Jain  | IT         |  49000 |        1 |
+------+--------------+------------+--------+----------+
6 rows in set (0.06 sec)

mysql> delete from employees where not department='it';
Query OK, 1 row affected (0.17 sec)

mysql> SELECT*FROM EMPLOYEES;
+------+--------------+------------+--------+----------+
| id   | name         | department | salary | isactive |
+------+--------------+------------+--------+----------+
|    1 | Rahul Sharma | IT         |  52000 |        1 |
|    4 | Sneha Patel  | IT         |  37000 |        1 |
|    7 | Kiran Rao    | IT         |  62000 |        1 |
|   13 | Arjun Reddy  | IT         |  49500 |        0 |
|   15 | Nikhil Jain  | IT         |  49000 |        1 |
+------+--------------+------------+--------+----------+
5 rows in set (0.04 sec)

mysql> REATE TABLE Projects (
    ->    id INT,
    ->    name VARCHAR(100),
    ->    assignedto VARCHAR(100),
    ->    start DATE,
    ->    end DATE
    ->    end DATE^C
mysql> CREATE TABLE Projects (
    ->    id INT,
    ->    name VARCHAR(100),
    ->    assignedto VARCHAR(100),
    ->    start DATE,
    ->    end DATE
    -> );
Query OK, 0 rows affected (0.04 sec)

mysql> INSERT INTO Projects VALUES
    -> (1, 'Website Revamp', 'Alice', '2024-01-15', '2024-03-01'),
    -> (2, 'Mobile App', 'Bob', '2024-02-01', NULL),
    -> (3, 'Data Migration', NULL, NULL, NULL),
    -> (4, 'SEO Optimization', 'Eve', '2024-03-10', '2024-04-20'),
    -> (5, 'Cloud Migration', NULL, '2024-03-15', NULL);
Query OK, 5 rows affected (0.01 sec)
Records: 5  Duplicates: 0  Warnings: 0

mysql> SELECT*FROM PROJECTS;
+------+------------------+------------+------------+------------+
| id   | name             | assignedto | start      | end        |
+------+------------------+------------+------------+------------+
|    1 | Website Revamp   | Alice      | 2024-01-15 | 2024-03-01 |
|    2 | Mobile App       | Bob        | 2024-02-01 | NULL       |
|    3 | Data Migration   | NULL       | NULL       | NULL       |
|    4 | SEO Optimization | Eve        | 2024-03-10 | 2024-04-20 |
|    5 | Cloud Migration  | NULL       | 2024-03-15 | NULL       |
+------+------------------+------------+------------+------------+
5 rows in set (0.00 sec)

mysql> SELECT*FROM PROJECTS WHERE ASSIGNEDTO IS NULL;
+------+-----------------+------------+------------+------+
| id   | name            | assignedto | start      | end  |
+------+-----------------+------------+------------+------+
|    3 | Data Migration  | NULL       | NULL       | NULL |
|    5 | Cloud Migration | NULL       | 2024-03-15 | NULL |
+------+-----------------+------------+------------+------+
2 rows in set (0.00 sec)

mysql> SELECT*FROM PROJECTS WHERE START IS NULL;
+------+----------------+------------+-------+------+
| id   | name           | assignedto | start | end  |
+------+----------------+------------+-------+------+
|    3 | Data Migration | NULL       | NULL  | NULL |
+------+----------------+------------+-------+------+
1 row in set (0.00 sec)

mysql> SELECT*FROM PROJECTS WHERE END IS NOT NULL;
+------+------------------+------------+------------+------------+
| id   | name             | assignedto | start      | end        |
+------+------------------+------------+------------+------------+
|    1 | Website Revamp   | Alice      | 2024-01-15 | 2024-03-01 |
|    4 | SEO Optimization | Eve        | 2024-03-10 | 2024-04-20 |
+------+------------------+------------+------------+------------+
2 rows in set (0.00 sec)

mysql> SELECT*FROM PROJECTS WHERE ASSIGNEDTO IS NOT NULL;
+------+------------------+------------+------------+------------+
| id   | name             | assignedto | start      | end        |
+------+------------------+------------+------------+------------+
|    1 | Website Revamp   | Alice      | 2024-01-15 | 2024-03-01 |
|    2 | Mobile App       | Bob        | 2024-02-01 | NULL       |
|    4 | SEO Optimization | Eve        | 2024-03-10 | 2024-04-20 |
+------+------------------+------------+------------+------------+
3 rows in set (0.00 sec)

mysql> UPDATE PROJECTS SET NAME='FRANK' WHERE ASSIGNEDTO IS NULL;
Query OK, 2 rows affected (0.01 sec)
Rows matched: 2  Changed: 2  Warnings: 0

mysql> SELECT*FROM PROJECTS;
+------+------------------+------------+------------+------------+
| id   | name             | assignedto | start      | end        |
+------+------------------+------------+------------+------------+
|    1 | Website Revamp   | Alice      | 2024-01-15 | 2024-03-01 |
|    2 | Mobile App       | Bob        | 2024-02-01 | NULL       |
|    3 | FRANK            | NULL       | NULL       | NULL       |
|    4 | SEO Optimization | Eve        | 2024-03-10 | 2024-04-20 |
|    5 | FRANK            | NULL       | 2024-03-15 | NULL       |
+------+------------------+------------+------------+------------+
5 rows in set (0.00 sec)

mysql> UPDATE PROJECTS SET START=CURDATE() WHERE START IS NULL;
Query OK, 1 row affected (0.01 sec)
Rows matched: 1  Changed: 1  Warnings: 0

mysql> SELECT*FROM PROJECTS;
+------+------------------+------------+------------+------------+
| id   | name             | assignedto | start      | end        |
+------+------------------+------------+------------+------------+
|    1 | Website Revamp   | Alice      | 2024-01-15 | 2024-03-01 |
|    2 | Mobile App       | Bob        | 2024-02-01 | NULL       |
|    3 | FRANK            | NULL       | 2026-09-10 | NULL       |
|    4 | SEO Optimization | Eve        | 2024-03-10 | 2024-04-20 |
|    5 | FRANK            | NULL       | 2024-03-15 | NULL       |
+------+------------------+------------+------------+------------+
5 rows in set (0.00 sec)

mysql> ^C
mysql> UPDATE PROJECTS SET NAME='COMPLETED' WHERE END IS NOT NULL;
Query OK, 2 rows affected (0.00 sec)
Rows matched: 2  Changed: 2  Warnings: 0

mysql> SELECT*FROM PROJECTS;
+------+------------+------------+------------+------------+
| id   | name       | assignedto | start      | end        |
+------+------------+------------+------------+------------+
|    1 | COMPLETED  | Alice      | 2024-01-15 | 2024-03-01 |
|    2 | Mobile App | Bob        | 2024-02-01 | NULL       |
|    3 | FRANK      | NULL       | 2026-09-10 | NULL       |
|    4 | COMPLETED  | Eve        | 2024-03-10 | 2024-04-20 |
|    5 | FRANK      | NULL       | 2024-03-15 | NULL       |
+------+------------+------------+------------+------------+
5 rows in set (0.00 sec)

mysql> DELETE FROM PROJECTS WHERE ASSIGNEDTO IS NULL;
Query OK, 2 rows affected (0.01 sec)

mysql> SELECT*FROM PROJECTS;
+------+------------+------------+------------+------------+
| id   | name       | assignedto | start      | end        |
+------+------------+------------+------------+------------+
|    1 | COMPLETED  | Alice      | 2024-01-15 | 2024-03-01 |
|    2 | Mobile App | Bob        | 2024-02-01 | NULL       |
|    4 | COMPLETED  | Eve        | 2024-03-10 | 2024-04-20 |
+------+------------+------------+------------+------------+
3 rows in set (0.00 sec)

mysql> DELETE FROM PROJECTS WHERE START IS NULL:
    -> ^C
mysql> DELETE FROM PROJECTS WHERE ASSIGNEDTO IS NULL;
Query OK, 0 rows affected (0.00 sec)

mysql> SELECT*FROM PROJECTS;
+------+------------+------------+------------+------------+
| id   | name       | assignedto | start      | end        |
+------+------------+------------+------------+------------+
|    1 | COMPLETED  | Alice      | 2024-01-15 | 2024-03-01 |
|    2 | Mobile App | Bob        | 2024-02-01 | NULL       |
|    4 | COMPLETED  | Eve        | 2024-03-10 | 2024-04-20 |
+------+------------+------------+------------+------------+
3 rows in set (0.00 sec)

mysql> DELETE FROM PROJECTS WHERE START IS NULL;
Query OK, 0 rows affected (0.00 sec)

mysql> SELECT*FROM PROJECTS;
+------+------------+------------+------------+------------+
| id   | name       | assignedto | start      | end        |
+------+------------+------------+------------+------------+
|    1 | COMPLETED  | Alice      | 2024-01-15 | 2024-03-01 |
|    2 | Mobile App | Bob        | 2024-02-01 | NULL       |
|    4 | COMPLETED  | Eve        | 2024-03-10 | 2024-04-20 |
+------+------------+------------+------------+------------+
3 rows in set (0.00 sec)

mysql> DELETE FROM PROJECTS WHERE END IS NOT NULL;
Query OK, 2 rows affected (0.01 sec)

mysql> SELECT*FROM PROJECTS;
+------+------------+------------+------------+------+
| id   | name       | assignedto | start      | end  |
+------+------------+------------+------------+------+
|    2 | Mobile App | Bob        | 2024-02-01 | NULL |
+------+------------+------------+------------+------+
1 row in set (0.00 sec)

mysql> UPDATE PROJECTS SET START=CURDATE() WHERE START IS NULL;
Query OK, 0 rows affected (0.00 sec)
Rows matched: 0  Changed: 0  Warnings: 0

mysql> SELECT*FROM PROJECTS;
+------+------------+------------+------------+------+
| id   | name       | assignedto | start      | end  |
+------+------------+------------+------------+------+
|    2 | Mobile App | Bob        | 2024-02-01 | NULL |
+------+------------+------------+------------+------+
1 row in set (0.00 sec)

mysql> CREATE TABLE Orders (
    ->  id INT,
    ->  customer_name VARCHAR(100),
    ->  order_date DATE,
    ->  total_amount DECIMAL(10,2)
    ->  );
Query OK, 0 rows affected (0.02 sec)

mysql> INSERT INTO Orders VALUES
    ->  (1, 'Alice', '2024-03-01', 1500.00),
    ->  (2, 'Bob', '2024-03-05', 450.00),
    ->  (3, 'Charlie', '2024-03-10', 2500.00),
    ->  (4, 'Diana', '2024-03-15', 800.00),
    ->  (5, 'Eve', '2024-03-20', 1200.00),
    ->  (6, 'Frank', '2024-03-25', 3000.00),
    ->  (7, 'Grace', '2024-04-02', 1800.00),
    ->  (8, 'Henry', '2024-04-08', 950.00),
    ->  (9, 'Ivy', '2024-04-12', 2750.00),
    ->  (10, 'Jack', '2024-04-18', 650.00),
    ->  (11, 'Kevin', '2024-04-22', 4200.00),
    ->  (12, 'Lily', '2024-05-01', 1350.00),
    ->  (13, 'Michael', '2024-05-08', 5000.00),
    ->  (14, 'Nancy', '2024-05-15', 2250.00),
    ->  (15, 'Oliver', '2024-05-25', 900.00);
Query OK, 15 rows affected (0.01 sec)
Records: 15  Duplicates: 0  Warnings: 0

mysql> SELECT*FROM ORDERS;
+------+---------------+------------+--------------+
| id   | customer_name | order_date | total_amount |
+------+---------------+------------+--------------+
|    1 | Alice         | 2024-03-01 |      1500.00 |
|    2 | Bob           | 2024-03-05 |       450.00 |
|    3 | Charlie       | 2024-03-10 |      2500.00 |
|    4 | Diana         | 2024-03-15 |       800.00 |
|    5 | Eve           | 2024-03-20 |      1200.00 |
|    6 | Frank         | 2024-03-25 |      3000.00 |
|    7 | Grace         | 2024-04-02 |      1800.00 |
|    8 | Henry         | 2024-04-08 |       950.00 |
|    9 | Ivy           | 2024-04-12 |      2750.00 |
|   10 | Jack          | 2024-04-18 |       650.00 |
|   11 | Kevin         | 2024-04-22 |      4200.00 |
|   12 | Lily          | 2024-05-01 |      1350.00 |
|   13 | Michael       | 2024-05-08 |      5000.00 |
|   14 | Nancy         | 2024-05-15 |      2250.00 |
|   15 | Oliver        | 2024-05-25 |       900.00 |
+------+---------------+------------+--------------+
15 rows in set (0.00 sec)

mysql> SELECT*FROM ORDERS WHERE ORDER_DATE BETWEEN '2024-03-03' AND '2024-03-10';
+------+---------------+------------+--------------+
| id   | customer_name | order_date | total_amount |
+------+---------------+------------+--------------+
|    2 | Bob           | 2024-03-05 |       450.00 |
|    3 | Charlie       | 2024-03-10 |      2500.00 |
+------+---------------+------------+--------------+
2 rows in set (0.00 sec)

mysql> SELECT*FROM ORDERS WHERE ORDER_DATE BETWEEN '2024-04-01' AND '2024-04-30';
+------+---------------+------------+--------------+
| id   | customer_name | order_date | total_amount |
+------+---------------+------------+--------------+
|    7 | Grace         | 2024-04-02 |      1800.00 |
|    8 | Henry         | 2024-04-08 |       950.00 |
|    9 | Ivy           | 2024-04-12 |      2750.00 |
|   10 | Jack          | 2024-04-18 |       650.00 |
|   11 | Kevin         | 2024-04-22 |      4200.00 |
+------+---------------+------------+--------------+
5 rows in set (0.00 sec)

mysql> SELECT*FROM ORDERS WHERE ORDER_DATE BETWEEN 500 AND 1500;
Empty set, 2 warnings (0.00 sec)

mysql> SELECT*FROM ORDERS WHERE TORAL_AMOUNT BETWEEN 500 AND 1500;
ERROR 1054 (42S22): Unknown column 'TORAL_AMOUNT' in 'where clause'
mysql> SELECT*FROM ORDERS WHERE TOTAL_AMOUNT BETWEEN 500 AND 1500;
+------+---------------+------------+--------------+
| id   | customer_name | order_date | total_amount |
+------+---------------+------------+--------------+
|    1 | Alice         | 2024-03-01 |      1500.00 |
|    4 | Diana         | 2024-03-15 |       800.00 |
|    5 | Eve           | 2024-03-20 |      1200.00 |
|    8 | Henry         | 2024-04-08 |       950.00 |
|   10 | Jack          | 2024-04-18 |       650.00 |
|   12 | Lily          | 2024-05-01 |      1350.00 |
|   15 | Oliver        | 2024-05-25 |       900.00 |
+------+---------------+------------+--------------+
7 rows in set (0.00 sec)

mysql> UPDATE ORDERS SET TOTAL_AMOUNT=TOTAL_AMOUNT+1000 WHERE ORDER_DATE BETWEEN '2024-03-04' AND '2024-03-10';
Query OK, 2 rows affected (0.01 sec)
Rows matched: 2  Changed: 2  Warnings: 0

mysql> SELECT*FROM ORDERS
    -> SELECT*FROM ORDERS;
ERROR 1064 (42000): You have an error in your SQL syntax; check the manual that corresponds to your MySQL server version for the right syntax to use near 'SELECT*FROM ORDERS' at line 2
mysql> select*from orders;
+------+---------------+------------+--------------+
| id   | customer_name | order_date | total_amount |
+------+---------------+------------+--------------+
|    1 | Alice         | 2024-03-01 |      1500.00 |
|    2 | Bob           | 2024-03-05 |      1450.00 |
|    3 | Charlie       | 2024-03-10 |      3500.00 |
|    4 | Diana         | 2024-03-15 |       800.00 |
|    5 | Eve           | 2024-03-20 |      1200.00 |
|    6 | Frank         | 2024-03-25 |      3000.00 |
|    7 | Grace         | 2024-04-02 |      1800.00 |
|    8 | Henry         | 2024-04-08 |       950.00 |
|    9 | Ivy           | 2024-04-12 |      2750.00 |
|   10 | Jack          | 2024-04-18 |       650.00 |
|   11 | Kevin         | 2024-04-22 |      4200.00 |
|   12 | Lily          | 2024-05-01 |      1350.00 |
|   13 | Michael       | 2024-05-08 |      5000.00 |
|   14 | Nancy         | 2024-05-15 |      2250.00 |
|   15 | Oliver        | 2024-05-25 |       900.00 |
+------+---------------+------------+--------------+
15 rows in set (0.00 sec)

mysql> update orders set total_amount=total_amount-200 where total_amount between 1000 and 2000;
Query OK, 5 rows affected (0.01 sec)
Rows matched: 5  Changed: 5  Warnings: 0

mysql> select*from orders;
+------+---------------+------------+--------------+
| id   | customer_name | order_date | total_amount |
+------+---------------+------------+--------------+
|    1 | Alice         | 2024-03-01 |      1300.00 |
|    2 | Bob           | 2024-03-05 |      1250.00 |
|    3 | Charlie       | 2024-03-10 |      3500.00 |
|    4 | Diana         | 2024-03-15 |       800.00 |
|    5 | Eve           | 2024-03-20 |      1000.00 |
|    6 | Frank         | 2024-03-25 |      3000.00 |
|    7 | Grace         | 2024-04-02 |      1600.00 |
|    8 | Henry         | 2024-04-08 |       950.00 |
|    9 | Ivy           | 2024-04-12 |      2750.00 |
|   10 | Jack          | 2024-04-18 |       650.00 |
|   11 | Kevin         | 2024-04-22 |      4200.00 |
|   12 | Lily          | 2024-05-01 |      1150.00 |
|   13 | Michael       | 2024-05-08 |      5000.00 |
|   14 | Nancy         | 2024-05-15 |      2250.00 |
|   15 | Oliver        | 2024-05-25 |       900.00 |
+------+---------------+------------+--------------+
15 rows in set (0.00 sec)

mysql> update orders set total_amount=total_amount+(total_amount*0.10) where total_amount between 2500 and 5000;
Query OK, 5 rows affected (0.00 sec)
Rows matched: 5  Changed: 5  Warnings: 0

mysql> select*from orders;
+------+---------------+------------+--------------+
| id   | customer_name | order_date | total_amount |
+------+---------------+------------+--------------+
|    1 | Alice         | 2024-03-01 |      1300.00 |
|    2 | Bob           | 2024-03-05 |      1250.00 |
|    3 | Charlie       | 2024-03-10 |      3850.00 |
|    4 | Diana         | 2024-03-15 |       800.00 |
|    5 | Eve           | 2024-03-20 |      1000.00 |
|    6 | Frank         | 2024-03-25 |      3300.00 |
|    7 | Grace         | 2024-04-02 |      1600.00 |
|    8 | Henry         | 2024-04-08 |       950.00 |
|    9 | Ivy           | 2024-04-12 |      3025.00 |
|   10 | Jack          | 2024-04-18 |       650.00 |
|   11 | Kevin         | 2024-04-22 |      4620.00 |
|   12 | Lily          | 2024-05-01 |      1150.00 |
|   13 | Michael       | 2024-05-08 |      5500.00 |
|   14 | Nancy         | 2024-05-15 |      2250.00 |
|   15 | Oliver        | 2024-05-25 |       900.00 |
+------+---------------+------------+--------------+
15 rows in set (0.00 sec)

mysql> delete from orders where order_date between '2024-03-10' and '2024-03-20';
Query OK, 3 rows affected (0.00 sec)

mysql> select*from orders;
+------+---------------+------------+--------------+
| id   | customer_name | order_date | total_amount |
+------+---------------+------------+--------------+
|    1 | Alice         | 2024-03-01 |      1300.00 |
|    2 | Bob           | 2024-03-05 |      1250.00 |
|    6 | Frank         | 2024-03-25 |      3300.00 |
|    7 | Grace         | 2024-04-02 |      1600.00 |
|    8 | Henry         | 2024-04-08 |       950.00 |
|    9 | Ivy           | 2024-04-12 |      3025.00 |
|   10 | Jack          | 2024-04-18 |       650.00 |
|   11 | Kevin         | 2024-04-22 |      4620.00 |
|   12 | Lily          | 2024-05-01 |      1150.00 |
|   13 | Michael       | 2024-05-08 |      5500.00 |
|   14 | Nancy         | 2024-05-15 |      2250.00 |
|   15 | Oliver        | 2024-05-25 |       900.00 |
+------+---------------+------------+--------------+
12 rows in set (0.00 sec)

mysql> delete orders whose total_amount is between 2500 and 5000;
ERROR 1064 (42000): You have an error in your SQL syntax; check the manual that corresponds to your MySQL server version for the right syntax to use near 'whose total_amount is between 2500 and 5000' at line 1
mysql> delete from orders whose total_amount is between 2500 and 5000;
ERROR 1064 (42000): You have an error in your SQL syntax; check the manual that corresponds to your MySQL server version for the right syntax to use near 'total_amount is between 2500 and 5000' at line 1
mysql> delete from orders where total_amount between 2500 and 5000;
Query OK, 3 rows affected (0.01 sec)

mysql> select*from orders;
+------+---------------+------------+--------------+
| id   | customer_name | order_date | total_amount |
+------+---------------+------------+--------------+
|    1 | Alice         | 2024-03-01 |      1300.00 |
|    2 | Bob           | 2024-03-05 |      1250.00 |
|    7 | Grace         | 2024-04-02 |      1600.00 |
|    8 | Henry         | 2024-04-08 |       950.00 |
|   10 | Jack          | 2024-04-18 |       650.00 |
|   12 | Lily          | 2024-05-01 |      1150.00 |
|   13 | Michael       | 2024-05-08 |      5500.00 |
|   14 | Nancy         | 2024-05-15 |      2250.00 |
|   15 | Oliver        | 2024-05-25 |       900.00 |
+------+---------------+------------+--------------+
9 rows in set (0.00 sec)

mysql> DROP TABLE EMP;
Query OK, 0 rows affected (0.02 sec)

mysql> CREATE TABLE Emp (
    ->  id INT,
    ->  name VARCHAR(100),
    ->  dept VARCHAR(20),
    ->  salary INT
    ->  );
Query OK, 0 rows affected (0.03 sec)

mysql> INSERT INTO Emp VALUES
    ->  (1, 'Alice', 'HR', 35000),
    ->  (2, 'Bob', 'IT', 50000),
    ->  (3, 'Charlie', 'Finance', 45000),
    ->  (4, 'Diana', 'Marketing', 40000),
    ->  (5, 'Eve', 'IT', 55000),
    ->  (6, 'Frank', 'Finance', 48000),
    ->  (7, 'Grace', 'Sales', 37000),
    ->  (8, 'Henry', 'Admin', 42000),
    ->  (9, 'Ivy', 'HR', 39000),
    ->  (10, 'Jack', 'Sales', 46000),
    ->  (11, 'Kevin', 'IT', 60000),
    ->  (12, 'Lily', 'Marketing', 41000),
    ->  (13, 'Michael', 'Admin', 38000),
    ->  (14, 'Nancy', 'Finance', 52000),
    ->  (15, 'Oliver', 'HR', 43000);
Query OK, 15 rows affected (0.01 sec)
Records: 15  Duplicates: 0  Warnings: 0

mysql> SELECT*FROM EMP;
+------+---------+-----------+--------+
| id   | name    | dept      | salary |
+------+---------+-----------+--------+
|    1 | Alice   | HR        |  35000 |
|    2 | Bob     | IT        |  50000 |
|    3 | Charlie | Finance   |  45000 |
|    4 | Diana   | Marketing |  40000 |
|    5 | Eve     | IT        |  55000 |
|    6 | Frank   | Finance   |  48000 |
|    7 | Grace   | Sales     |  37000 |
|    8 | Henry   | Admin     |  42000 |
|    9 | Ivy     | HR        |  39000 |
|   10 | Jack    | Sales     |  46000 |
|   11 | Kevin   | IT        |  60000 |
|   12 | Lily    | Marketing |  41000 |
|   13 | Michael | Admin     |  38000 |
|   14 | Nancy   | Finance   |  52000 |
|   15 | Oliver  | HR        |  43000 |
+------+---------+-----------+--------+
15 rows in set (0.00 sec)

mysql> SELECT*FROM EMP WHERE DEPT IN('FINANCE','IT');
+------+---------+---------+--------+
| id   | name    | dept    | salary |
+------+---------+---------+--------+
|    2 | Bob     | IT      |  50000 |
|    3 | Charlie | Finance |  45000 |
|    5 | Eve     | IT      |  55000 |
|    6 | Frank   | Finance |  48000 |
|   11 | Kevin   | IT      |  60000 |
|   14 | Nancy   | Finance |  52000 |
+------+---------+---------+--------+
6 rows in set (0.00 sec)

mysql> UPDATE EMP SET SALARY=(SALARY+2000) WHERE DEPT IN('HR','MARKETING');
Query OK, 5 rows affected (0.00 sec)
Rows matched: 5  Changed: 5  Warnings: 0

mysql> SELECT*FROM EMP;
+------+---------+-----------+--------+
| id   | name    | dept      | salary |
+------+---------+-----------+--------+
|    1 | Alice   | HR        |  37000 |
|    2 | Bob     | IT        |  50000 |
|    3 | Charlie | Finance   |  45000 |
|    4 | Diana   | Marketing |  42000 |
|    5 | Eve     | IT        |  55000 |
|    6 | Frank   | Finance   |  48000 |
|    7 | Grace   | Sales     |  37000 |
|    8 | Henry   | Admin     |  42000 |
|    9 | Ivy     | HR        |  41000 |
|   10 | Jack    | Sales     |  46000 |
|   11 | Kevin   | IT        |  60000 |
|   12 | Lily    | Marketing |  43000 |
|   13 | Michael | Admin     |  38000 |
|   14 | Nancy   | Finance   |  52000 |
|   15 | Oliver  | HR        |  45000 |
+------+---------+-----------+--------+
15 rows in set (0.00 sec)

mysql> DELETE FROM EMP WHERE DEPT IN('FINANCE','MARKETING');
Query OK, 5 rows affected (0.01 sec)

mysql> SELECT*FROM EMP;
+------+---------+-------+--------+
| id   | name    | dept  | salary |
+------+---------+-------+--------+
|    1 | Alice   | HR    |  37000 |
|    2 | Bob     | IT    |  50000 |
|    5 | Eve     | IT    |  55000 |
|    7 | Grace   | Sales |  37000 |
|    8 | Henry   | Admin |  42000 |
|    9 | Ivy     | HR    |  41000 |
|   10 | Jack    | Sales |  46000 |
|   11 | Kevin   | IT    |  60000 |
|   13 | Michael | Admin |  38000 |
|   15 | Oliver  | HR    |  45000 |
+------+---------+-------+--------+
10 rows in set (0.00 sec)

mysql> SHOW TABLES;
+---------------+
| Tables_in_da6 |
+---------------+
| emp           |
| employees     |
| orders        |
| products      |
| projects      |
| studentscores |
+---------------+
6 rows in set (0.03 sec)

mysql> DROP TABLE EMPLOYEES;
Query OK, 0 rows affected (0.03 sec)

mysql> CREATE TABLE employees (
    ->     emp_id INT PRIMARY KEY,
    ->     emp_name VARCHAR(50),
    ->     department VARCHAR(30),
    ->     salary DECIMAL(10,2),
    ->     experience INT,
    ->     age INT
    -> );
Query OK, 0 rows affected (0.02 sec)

mysql> INSERT INTO employees VALUES
    -> (101,'Ravi','IT',65000,5,28),
    -> (102,'Priya','HR',45000,2,24),
    -> (103,'Amit','Finance',75000,8,35),
    -> (104,'Sneha','IT',55000,3,27),
    -> (105,'Rahul','Sales',40000,1,22),
    -> (106,'Kiran','Finance',90000,12,40),
    -> (107,'Anjali','HR',52000,4,29),
    -> (108,'Suresh','Sales',68000,7,33);
Query OK, 8 rows affected (0.01 sec)
Records: 8  Duplicates: 0  Warnings: 0

mysql> SELECT*FROM EMPLOYEES;
+--------+----------+------------+----------+------------+------+
| emp_id | emp_name | department | salary   | experience | age  |
+--------+----------+------------+----------+------------+------+
|    101 | Ravi     | IT         | 65000.00 |          5 |   28 |
|    102 | Priya    | HR         | 45000.00 |          2 |   24 |
|    103 | Amit     | Finance    | 75000.00 |          8 |   35 |
|    104 | Sneha    | IT         | 55000.00 |          3 |   27 |
|    105 | Rahul    | Sales      | 40000.00 |          1 |   22 |
|    106 | Kiran    | Finance    | 90000.00 |         12 |   40 |
|    107 | Anjali   | HR         | 52000.00 |          4 |   29 |
|    108 | Suresh   | Sales      | 68000.00 |          7 |   33 |
+--------+----------+------------+----------+------------+------+
8 rows in set (0.00 sec)

mysql> SELECT EMP_NAME,
    -> SALARY,
    -> CASE
    -> WHEN SALARY>=80000 THEN 'HIGH SALARY'
    -> WHEN SALARY>=60000 THEN 'MEDIUM-SALARY'
    -> ELSE 'LOW SALARY'
    -> END AS SALARY_CATEGORY
    -> FROM EMPLOYEES;
+----------+----------+-----------------+
| EMP_NAME | SALARY   | SALARY_CATEGORY |
+----------+----------+-----------------+
| Ravi     | 65000.00 | MEDIUM-SALARY   |
| Priya    | 45000.00 | LOW SALARY      |
| Amit     | 75000.00 | MEDIUM-SALARY   |
| Sneha    | 55000.00 | LOW SALARY      |
| Rahul    | 40000.00 | LOW SALARY      |
| Kiran    | 90000.00 | HIGH SALARY     |
| Anjali   | 52000.00 | LOW SALARY      |
| Suresh   | 68000.00 | MEDIUM-SALARY   |
+----------+----------+-----------------+
8 rows in set (0.00 sec)

mysql> SELECT EMP_NAME,
    -> EXPERIENCE,
    -> WHERE EXPERIENCE>=10 THEN 'EXPERT'
    -> WHERE EXPERIENCE>=10 THEN 'EXPERT'^C
mysql> SELECT EMP_NAME,
    -> EXPERIENCE,
    -> CASE
    -> WHEN EXPERIENCE>=10 THEN 'EXPERT'
    -> WHEN EXPERIENCE>=5 THEN 'SENIOR'
    -> WHEN EXPERIENCE>=2 THEN 'JUNIOR FRESER'
    -> ELSE 'FRESHER'
    -> END AS EXPERIENCE_LEVEL
    -> FROM EMPLOYEES;
+----------+------------+------------------+
| EMP_NAME | EXPERIENCE | EXPERIENCE_LEVEL |
+----------+------------+------------------+
| Ravi     |          5 | SENIOR           |
| Priya    |          2 | JUNIOR FRESER    |
| Amit     |          8 | SENIOR           |
| Sneha    |          3 | JUNIOR FRESER    |
| Rahul    |          1 | FRESHER          |
| Kiran    |         12 | EXPERT           |
| Anjali   |          4 | JUNIOR FRESER    |
| Suresh   |          7 | SENIOR           |
+----------+------------+------------------+
8 rows in set (0.00 sec)

mysql>
mysql> SELECT*FROM EMPLOYEES WHERE EMP_NAME LIKE 'R%';
+--------+----------+------------+----------+------------+------+
| emp_id | emp_name | department | salary   | experience | age  |
+--------+----------+------------+----------+------------+------+
|    101 | Ravi     | IT         | 65000.00 |          5 |   28 |
|    105 | Rahul    | Sales      | 40000.00 |          1 |   22 |
+--------+----------+------------+----------+------------+------+
2 rows in set (0.01 sec)

mysql> SLECT*FROM EMPLOYEES WHERE EMP_NAME LIKE '%A';
ERROR 1064 (42000): You have an error in your SQL syntax; check the manual that corresponds to your MySQL server version for the right syntax to use near 'SLECT*FROM EMPLOYEES WHERE EMP_NAME LIKE '%A'' at line 1
mysql> SELECT*FROM EMPLOYEES WHERE EMP_NAME LIKE '%A';
+--------+----------+------------+----------+------------+------+
| emp_id | emp_name | department | salary   | experience | age  |
+--------+----------+------------+----------+------------+------+
|    102 | Priya    | HR         | 45000.00 |          2 |   24 |
|    104 | Sneha    | IT         | 55000.00 |          3 |   27 |
+--------+----------+------------+----------+------------+------+
2 rows in set (0.00 sec)

mysql> SELECT*FROM EMPLOYEES WHERE EMP_NAME LIKE 'P%A';
+--------+----------+------------+----------+------------+------+
| emp_id | emp_name | department | salary   | experience | age  |
+--------+----------+------------+----------+------------+------+
|    102 | Priya    | HR         | 45000.00 |          2 |   24 |
+--------+----------+------------+----------+------------+------+
1 row in set (0.00 sec)

mysql> SELECT*FROM EMPLOYEES WHERE EMP_NAME LIKE '____';
+--------+----------+------------+----------+------------+------+
| emp_id | emp_name | department | salary   | experience | age  |
+--------+----------+------------+----------+------------+------+
|    101 | Ravi     | IT         | 65000.00 |          5 |   28 |
|    103 | Amit     | Finance    | 75000.00 |          8 |   35 |
+--------+----------+------------+----------+------------+------+
2 rows in set (0.00 sec)

mysql> SELECT*FROM EMPLOYEES WHERE EMP_NAME LIKE '%A%';
+--------+----------+------------+----------+------------+------+
| emp_id | emp_name | department | salary   | experience | age  |
+--------+----------+------------+----------+------------+------+
|    101 | Ravi     | IT         | 65000.00 |          5 |   28 |
|    102 | Priya    | HR         | 45000.00 |          2 |   24 |
|    103 | Amit     | Finance    | 75000.00 |          8 |   35 |
|    104 | Sneha    | IT         | 55000.00 |          3 |   27 |
|    105 | Rahul    | Sales      | 40000.00 |          1 |   22 |
|    106 | Kiran    | Finance    | 90000.00 |         12 |   40 |
|    107 | Anjali   | HR         | 52000.00 |          4 |   29 |
+--------+----------+------------+----------+------------+------+
7 rows in set (0.00 sec)

mysql> SELECT*FROM EMPLOYEES WHERE EMP_NAME LIKE 'A%I';
+--------+----------+------------+----------+------------+------+
| emp_id | emp_name | department | salary   | experience | age  |
+--------+----------+------------+----------+------------+------+
|    107 | Anjali   | HR         | 52000.00 |          4 |   29 |
+--------+----------+------------+----------+------------+------+
1 row in set (0.00 sec)

mysql> SELECT*FROM EMPLOYEES WHERE EMP_NAME LIKE 'A_I';
Empty set (0.00 sec)

mysql>



